{
  "template_id": "fallback.default",
  "domain_tags": [
    "general",
    "business"
  ],
  "audience_tags": [
    "stakeholders",
    "reviewers"
  ],
  "tone_tags": [
    "professional",
    "clear"
  ],
  "color_scheme": {
    "primary": "#1F4E79",
    "secondary": "#70AD47",
    "accent": "#F4B183",
    "background": "#FFFFFF"
  },
  "style": "Clean professional fallback template with editable text zones.",
  "slide_count": 8,
  "preview_paths": [],
  "retrieval_text": "general business project report professional clean",
  "slides": [
    {
      "index": 0,
      "layout": "cover.hero",
      "visual_density": "medium",
      "supports_generated_background": false,
      "zones": [
        {
          "zone_id": "title",
          "type": "title",
          "position": [
            0.08,
            0.08,
            0.84,
            0.16
          ],
          "font_size": 34
        },
        {
          "zone_id": "bullets",
          "type": "bullets",
          "position": [
            0.1,
            0.28,
            0.52,
            0.54
          ],
          "font_size": 20
        },
        {
          "zone_id": "image",
          "type": "image",
          "position": [
            0.68,
            0.3,
            0.24,
            0.4
          ],
          "font_size": 14
        }
      ]
    },
    {
      "index": 1,
      "layout": "fallback.basic",
      "visual_density": "medium",
      "supports_generated_background": false,
      "zones": [
        {
          "zone_id": "title",
          "type": "title",
          "position": [
            0.08,
            0.08,
            0.84,
            0.16
          ],
          "font_size": 34
        },
        {
          "zone_id": "bullets",
          "type": "bullets",
          "position": [
            0.1,
            0.28,
            0.52,
            0.54
          ],
          "font_size": 20
        },
        {
          "zone_id": "image",
          "type": "image",
          "position": [
            0.68,
            0.3,
            0.24,
            0.4
          ],
          "font_size": 14
        }
      ]
    },
    {
      "index": 2,
      "layout": "fallback.basic",
      "visual_density": "medium",
      "supports_generated_background": false,
      "zones": [
        {
          "zone_id": "title",
          "type": "title",
          "position": [
            0.08,
            0.08,
            0.84,
            0.16
          ],
          "font_size": 34
        },
        {
          "zone_id": "bullets",
          "type": "bullets",
          "position": [
            0.1,
            0.28,
            0.52,
            0.54
          ],
          "font_size": 20
        },
        {
          "zone_id": "image",
          "type": "image",
          "position": [
            0.68,
            0.3,
            0.24,
            0.4
          ],
          "font_size": 14
        }
      ]
    },
    {
      "index": 3,
      "layout": "fallback.basic",
      "visual_density": "medium",
      "supports_generated_background": false,
      "zones": [
        {
          "zone_id": "title",
          "type": "title",
          "position": [
            0.08,
            0.08,
            0.84,
            0.16
          ],
          "font_size": 34
        },
        {
          "zone_id": "bullets",
          "type": "bullets",
          "position": [
            0.1,
            0.28,
            0.52,
            0.54
          ],
          "font_size": 20
        },
        {
          "zone_id": "image",
          "type": "image",
          "position": [
            0.68,
            0.3,
            0.24,
            0.4
          ],
          "font_size": 14
        }
      ]
    },
    {
      "index": 4,
      "layout": "fallback.basic",
      "visual_density": "medium",
      "supports_generated_background": false,
      "zones": [
        {
          "zone_id": "title",
          "type": "title",
          "position": [
            0.08,
            0.08,
            0.84,
            0.16
          ],
          "font_size": 34
        },
        {
          "zone_id": "bullets",
          "type": "bullets",
          "position": [
            0.1,
            0.28,
            0.52,
            0.54
          ],
          "font_size": 20
        },
        {
          "zone_id": "image",
          "type": "image",
          "position": [
            0.68,
            0.3,
            0.24,
            0.4
          ],
          "font_size": 14
        }
      ]
    },
    {
      "index": 5,
      "layout": "fallback.basic",
      "visual_density": "medium",
      "supports_generated_background": false,
      "zones": [
        {
          "zone_id": "title",
          "type": "title",
          "position": [
            0.08,
            0.08,
            0.84,
            0.16
          ],
          "font_size": 34
        },
        {
          "zone_id": "bullets",
          "type": "bullets",
          "position": [
            0.1,
            0.28,
            0.52,
            0.54
          ],
          "font_size": 20
        },
        {
          "zone_id": "image",
          "type": "image",
          "position": [
            0.68,
            0.3,
            0.24,
            0.4
          ],
          "font_size": 14
        }
      ]
    },
    {
      "index": 6,
      "layout": "fallback.basic",
      "visual_density": "medium",
      "supports_generated_background": false,
      "zones": [
        {
          "zone_id": "title",
          "type": "title",
          "position": [
            0.08,
            0.08,
            0.84,
            0.16
          ],
          "font_size": 34
        },
        {
          "zone_id": "bullets",
          "type": "bullets",
          "position": [
            0.1,
            0.28,
            0.52,
            0.54
          ],
          "font_size": 20
        },
        {
          "zone_id": "image",
          "type": "image",
          "position": [
            0.68,
            0.3,
            0.24,
            0.4
          ],
          "font_size": 14
        }
      ]
    },
    {
      "index": 7,
      "layout": "fallback.basic",
      "visual_density": "medium",
      "supports_generated_background": false,
      "zones": [
        {
          "zone_id": "title",
          "type": "title",
          "position": [
            0.08,
            0.08,
            0.84,
            0.16
          ],
          "font_size": 34
        },
        {
          "zone_id": "bullets",
          "type": "bullets",
          "position": [
            0.1,
            0.28,
            0.52,
            0.54
          ],
          "font_size": 20
        },
        {
          "zone_id": "image",
          "type": "image",
          "position": [
            0.68,
            0.3,
            0.24,
            0.4
          ],
          "font_size": 14
        }
      ]
    }
  ]
}
